{
  "schema": "ardyn.phase-5.78.ci-enforcement-contract-boundary-map-result",
  "schemaVersion": "0.1.0",
  "ciEnforcementContractKind": "ci-enforcement-contract-boundary-map",
  "ciEnforcementContractMode": "review-only",
  "reviewedAt": "2026-07-06T00:00:00.000Z",
  "reviewedAtDefaulted": false,
  "classification": "valid_ci_enforcement_contract_boundary_map_runtime_still_blocked",
  "ciEnforcementContractBoundaryMapProduced": true,
  "boundaryEntries": [
    {
      "boundaryId": "phase5-78.ardyn.ci_workflow_scope",
      "boundaryFamily": "ci_workflow_scope",
      "relatedSystem": "github-actions",
      "currentStatus": "blocked",
      "allowedCurrentBehavior": [
        "Record the required CI workflow scope contract.",
        "Document exactly two workflows: ci.yml and security.yml.",
        "Record allowed third-party actions pinned to exact versions."
      ],
      "forbiddenCurrentBehavior": [
        "Create workflow files under .github/.",
        "Add triggers beyond push-to-main, pull_request, weekly schedule, and workflow_dispatch.",
        "Use secrets in CI workflows."
      ],
      "requiredFutureContractBeforeImplementation": [
        "Exactly two workflows: ci.yml (push to main + pull_request; concurrency cancel-in-progress) and security.yml (weekly schedule + workflow_dispatch)",
        "permissions: contents: read",
        "No secrets",
        "Allowed third-party actions ONLY: actions/checkout, actions/setup-node, dtolnay/rust-toolchain, Swatinem/rust-cache — each pinned to exact version or commit SHA"
      ],
      "requiredFutureAuthorizationPhaseBeforeRuntime": "phase-5.79-ci-enablement",
      "contractShape": {
        "workflowCount": "integer 2 (required)",
        "workflows": "array [ci.yml, security.yml] (required)",
        "triggers": "object (required: push, pull_request, schedule, workflow_dispatch only)",
        "permissions": "object (required: contents: read)",
        "secrets": "array (required: empty)",
        "allowedActions": "array (required, pinned versions)"
      },
      "crossPhaseReferences": [
        "5.48 area 7 (CI not asserted — this phase provides the contract)",
        "5.69 (CI modification forbidden — this phase authorizes 5.79 to lift)",
        "5.71 (same)"
      ],
      "explicitBlockedAuthorizationFlags": {
        "runtimeAuthorized": false,
        "authorizesRuntime": false,
        "ciExecutionAuthorizationGranted": false,
        "workflowFileCreationAuthorizationGranted": false,
        "ciPublishAuthorizationGranted": false,
        "ciDeployAuthorizationGranted": false,
        "ciWriteToRepoAuthorizationGranted": false,
        "ciSecretUseAuthorizationGranted": false,
        "ciTokenMintAuthorizationGranted": false,
        "ciAutoMergeAuthorizationGranted": false,
        "semgrepGateAuthorizationGranted": false,
        "fabricSecretInCiAuthorizationGranted": false,
        "commandExposureAuthorizationGranted": false,
        "approvalDecisionProduced": false,
        "approvalGrantProduced": false
      },
      "unsafeCiEnforcementRuntimeFlags": {
        "runtimeExecutionEnabled": false,
        "runtimeAuthorizationEnabled": false,
        "runtimeCommandEnabled": false,
        "commandExposureEnabled": false,
        "commandsExposed": false,
        "connectorGrantProduced": false,
        "ciRuntimeEnabled": false,
        "ciExecutionEnabled": false,
        "workflowExecutionEnabled": false,
        "ciPublishedArtifacts": false,
        "ciDeployEnabled": false,
        "ciWriteToRepoEnabled": false,
        "ciSecretUsed": false,
        "ciTokenMinted": false,
        "ciAutoMergeEnabled": false,
        "semgrepGateEnabled": false,
        "fabricSecretInCiEnabled": false,
        "fabricSidecarContactEnabled": false,
        "shellRuntimeEnabled": false,
        "sqliteRuntimeEnabled": false,
        "embeddedDbReaderEnabled": false,
        "databaseClientImplemented": false,
        "matrixClientRuntimeEnabled": false,
        "externalGatewayRuntimeEnabled": false,
        "fabricCoreTransportRuntimeEnabled": false,
        "fabricRuntimeImplementedByArdyn": false,
        "secureDropImplemented": false,
        "secureDropDecryptionEnabled": false,
        "filesystemAccessEnabled": false,
        "filesystemReadEnabled": false,
        "filesystemWriteEnabled": false,
        "backendRuntimeImplementedByArdyn": false,
        "backendApiServerMiddlewareImplemented": false,
        "apiEndpointImplementedByArdyn": false,
        "serverImplementedByArdyn": false,
        "processSpawnEnabled": false,
        "processControlEnabled": false,
        "blockedCliBypassEnabled": false
      },
      "runtimeEffect": {
        "runtimeEnabled": false,
        "runtimeStarted": false,
        "runtimeReady": false,
        "runtimeCommandEnabled": false,
        "runtimeCommandExposureEnabled": false,
        "runtimeExecutionEnabled": false,
        "runtimeExecuted": false,
        "approvalGrantProduced": false,
        "approvalGrantPersisted": false,
        "approvalEvaluatorAuthoritative": false
      },
      "nonAuthorizingProof": true,
      "ciEnforcementContractBoundaryMetadataOnly": true,
      "noLiveCiEnforcementRuntimePerformed": true
    },
    {
      "boundaryId": "phase5-78.ardyn.ci_job_matrix",
      "boundaryFamily": "ci_job_matrix",
      "relatedSystem": "github-actions",
      "currentStatus": "blocked",
      "allowedCurrentBehavior": [
        "Record the required CI job matrix contract.",
        "Document three jobs: node, rust, node-windows."
      ],
      "forbiddenCurrentBehavior": [
        "Execute CI jobs.",
        "Add jobs beyond node, rust, and node-windows.",
        "Omit the node-windows job (required for Windows hazard coverage)."
      ],
      "requiredFutureContractBeforeImplementation": [
        "node job (ubuntu: npm ci; npm test; npm run report:phase-status smoke discarded to null)",
        "rust job (ubuntu: cargo fmt --check; cargo clippy --workspace --all-targets -- -D warnings; cargo test --workspace)",
        "node-windows job (windows-latest: npm ci; npm test) — included because development happens on Windows and the test-script glob has a known Windows/Node-20 expansion hazard"
      ],
      "requiredFutureAuthorizationPhaseBeforeRuntime": "phase-5.79-ci-enablement",
      "contractShape": {
        "jobs": "array [node, rust, node-windows] (required)",
        "nodeJob": "object (required: ubuntu, npm ci, npm test)",
        "rustJob": "object (required: ubuntu, cargo fmt/clippy/test)",
        "nodeWindowsJob": "object (required: windows-latest, npm ci, npm test)"
      },
      "crossPhaseReferences": [
        "5.77 (Code Mode orchestration — CI runs these tests)",
        "5.76 (embedded DB/query engine — CI runs these tests)"
      ],
      "explicitBlockedAuthorizationFlags": {
        "runtimeAuthorized": false,
        "authorizesRuntime": false,
        "ciExecutionAuthorizationGranted": false,
        "workflowFileCreationAuthorizationGranted": false,
        "ciPublishAuthorizationGranted": false,
        "ciDeployAuthorizationGranted": false,
        "ciWriteToRepoAuthorizationGranted": false,
        "ciSecretUseAuthorizationGranted": false,
        "ciTokenMintAuthorizationGranted": false,
        "ciAutoMergeAuthorizationGranted": false,
        "semgrepGateAuthorizationGranted": false,
        "fabricSecretInCiAuthorizationGranted": false,
        "commandExposureAuthorizationGranted": false,
        "approvalDecisionProduced": false,
        "approvalGrantProduced": false
      },
      "unsafeCiEnforcementRuntimeFlags": {
        "runtimeExecutionEnabled": false,
        "runtimeAuthorizationEnabled": false,
        "runtimeCommandEnabled": false,
        "commandExposureEnabled": false,
        "commandsExposed": false,
        "connectorGrantProduced": false,
        "ciRuntimeEnabled": false,
        "ciExecutionEnabled": false,
        "workflowExecutionEnabled": false,
        "ciPublishedArtifacts": false,
        "ciDeployEnabled": false,
        "ciWriteToRepoEnabled": false,
        "ciSecretUsed": false,
        "ciTokenMinted": false,
        "ciAutoMergeEnabled": false,
        "semgrepGateEnabled": false,
        "fabricSecretInCiEnabled": false,
        "fabricSidecarContactEnabled": false,
        "shellRuntimeEnabled": false,
        "sqliteRuntimeEnabled": false,
        "embeddedDbReaderEnabled": false,
        "databaseClientImplemented": false,
        "matrixClientRuntimeEnabled": false,
        "externalGatewayRuntimeEnabled": false,
        "fabricCoreTransportRuntimeEnabled": false,
        "fabricRuntimeImplementedByArdyn": false,
        "secureDropImplemented": false,
        "secureDropDecryptionEnabled": false,
        "filesystemAccessEnabled": false,
        "filesystemReadEnabled": false,
        "filesystemWriteEnabled": false,
        "backendRuntimeImplementedByArdyn": false,
        "backendApiServerMiddlewareImplemented": false,
        "apiEndpointImplementedByArdyn": false,
        "serverImplementedByArdyn": false,
        "processSpawnEnabled": false,
        "processControlEnabled": false,
        "blockedCliBypassEnabled": false
      },
      "runtimeEffect": {
        "runtimeEnabled": false,
        "runtimeStarted": false,
        "runtimeReady": false,
        "runtimeCommandEnabled": false,
        "runtimeCommandExposureEnabled": false,
        "runtimeExecutionEnabled": false,
        "runtimeExecuted": false,
        "approvalGrantProduced": false,
        "approvalGrantPersisted": false,
        "approvalEvaluatorAuthoritative": false
      },
      "nonAuthorizingProof": true,
      "ciEnforcementContractBoundaryMetadataOnly": true,
      "noLiveCiEnforcementRuntimePerformed": true
    },
    {
      "boundaryId": "phase5-78.ardyn.security_workflow_scope",
      "boundaryFamily": "security_workflow_scope",
      "relatedSystem": "github-actions",